[
  {"id":"apr-001","clientId":"demo","dealId":"deal-001","approvalType":"ic","requestedByUserId":"user-1","requestedByName":"Иван Петров","status":"approved","dueAt":"2024-02-01T00:00:00Z","decidedByUserId":"user-3","decidedByName":"Мария Козлова","decidedAt":"2024-01-28T10:00:00Z","notes":"Approved for Series B participation","createdAt":"2024-01-20T10:00:00Z","updatedAt":"2024-01-28T10:00:00Z"},
  {"id":"apr-002","clientId":"demo","dealId":"deal-001","approvalType":"legal","requestedByUserId":"user-1","requestedByName":"Иван Петров","status":"approved","dueAt":"2024-02-10T00:00:00Z","decidedByUserId":"user-4","decidedByName":"Александр Волков","decidedAt":"2024-02-05T10:00:00Z","createdAt":"2024-01-28T10:00:00Z","updatedAt":"2024-02-05T10:00:00Z"},
  {"id":"apr-003","clientId":"demo","dealId":"deal-001","approvalType":"cfo","requestedByUserId":"user-1","requestedByName":"Иван Петров","status":"pending","dueAt":"2024-03-01T00:00:00Z","createdAt":"2024-02-15T10:00:00Z","updatedAt":"2024-02-15T10:00:00Z"},
  {"id":"apr-004","clientId":"demo","dealId":"deal-002","approvalType":"ic","requestedByUserId":"user-2","requestedByName":"Елена Сидорова","status":"approved","dueAt":"2024-02-05T00:00:00Z","decidedByUserId":"user-3","decidedByName":"Мария Козлова","decidedAt":"2024-02-01T10:00:00Z","createdAt":"2024-01-25T10:00:00Z","updatedAt":"2024-02-01T10:00:00Z"},
  {"id":"apr-005","clientId":"demo","dealId":"deal-002","approvalType":"legal","requestedByUserId":"user-2","requestedByName":"Елена Сидорова","status":"pending","dueAt":"2024-02-28T00:00:00Z","createdAt":"2024-02-10T10:00:00Z","updatedAt":"2024-02-10T10:00:00Z"},
  {"id":"apr-006","clientId":"demo","dealId":"deal-003","approvalType":"ic","requestedByUserId":"user-1","requestedByName":"Иван Петров","status":"pending","dueAt":"2024-02-25T00:00:00Z","createdAt":"2024-02-15T10:00:00Z","updatedAt":"2024-02-15T10:00:00Z"},
  {"id":"apr-007","clientId":"demo","dealId":"deal-004","approvalType":"ic","requestedByUserId":"user-2","requestedByName":"Елена Сидорова","status":"approved","dueAt":"2024-01-15T00:00:00Z","decidedByUserId":"user-3","decidedByName":"Мария Козлова","decidedAt":"2024-01-10T10:00:00Z","createdAt":"2024-01-05T10:00:00Z","updatedAt":"2024-01-10T10:00:00Z"},
  {"id":"apr-008","clientId":"demo","dealId":"deal-004","approvalType":"cfo","requestedByUserId":"user-2","requestedByName":"Елена Сидорова","status":"approved","dueAt":"2024-01-20T00:00:00Z","decidedByUserId":"user-5","decidedByName":"Дмитрий Новиков","decidedAt":"2024-01-18T10:00:00Z","createdAt":"2024-01-10T10:00:00Z","updatedAt":"2024-01-18T10:00:00Z"},
  {"id":"apr-009","clientId":"demo","dealId":"deal-007","approvalType":"ic","requestedByUserId":"user-1","requestedByName":"Иван Петров","status":"approved","dueAt":"2024-02-10T00:00:00Z","decidedByUserId":"user-3","decidedByName":"Мария Козлова","decidedAt":"2024-02-08T10:00:00Z","createdAt":"2024-02-01T10:00:00Z","updatedAt":"2024-02-08T10:00:00Z"},
  {"id":"apr-010","clientId":"demo","dealId":"deal-007","approvalType":"cfo","requestedByUserId":"user-1","requestedByName":"Иван Петров","status":"approved","dueAt":"2024-02-15T00:00:00Z","decidedByUserId":"user-5","decidedByName":"Дмитрий Новиков","decidedAt":"2024-02-12T10:00:00Z","createdAt":"2024-02-08T10:00:00Z","updatedAt":"2024-02-12T10:00:00Z"},
  {"id":"apr-011","clientId":"demo","dealId":"deal-008","approvalType":"ic","requestedByUserId":"user-2","requestedByName":"Елена Сидорова","status":"approved","dueAt":"2023-11-20T00:00:00Z","decidedByUserId":"user-3","decidedByName":"Мария Козлова","decidedAt":"2023-11-15T10:00:00Z","createdAt":"2023-11-05T10:00:00Z","updatedAt":"2023-11-15T10:00:00Z"},
  {"id":"apr-012","clientId":"demo","dealId":"deal-008","approvalType":"legal","requestedByUserId":"user-2","requestedByName":"Елена Сидорова","status":"approved","dueAt":"2023-12-01T00:00:00Z","decidedByUserId":"user-4","decidedByName":"Александр Волков","decidedAt":"2023-11-28T10:00:00Z","createdAt":"2023-11-15T10:00:00Z","updatedAt":"2023-11-28T10:00:00Z"},
  {"id":"apr-013","clientId":"demo","dealId":"deal-008","approvalType":"cfo","requestedByUserId":"user-2","requestedByName":"Елена Сидорова","status":"approved","dueAt":"2024-01-10T00:00:00Z","decidedByUserId":"user-5","decidedByName":"Дмитрий Новиков","decidedAt":"2024-01-05T10:00:00Z","createdAt":"2023-12-20T10:00:00Z","updatedAt":"2024-01-05T10:00:00Z"},
  {"id":"apr-014","clientId":"demo","dealId":"deal-009","approvalType":"ic","requestedByUserId":"user-1","requestedByName":"Иван Петров","status":"approved","dueAt":"2024-02-01T00:00:00Z","decidedByUserId":"user-3","decidedByName":"Мария Козлова","decidedAt":"2024-01-28T10:00:00Z","createdAt":"2024-01-20T10:00:00Z","updatedAt":"2024-01-28T10:00:00Z"},
  {"id":"apr-015","clientId":"demo","dealId":"deal-009","approvalType":"legal","requestedByUserId":"user-1","requestedByName":"Иван Петров","status":"pending","dueAt":"2024-02-25T00:00:00Z","createdAt":"2024-02-05T10:00:00Z","updatedAt":"2024-02-05T10:00:00Z"},
  {"id":"apr-016","clientId":"demo","dealId":"deal-010","approvalType":"ic","requestedByUserId":"user-2","requestedByName":"Елена Сидорова","status":"pending","dueAt":"2024-02-28T00:00:00Z","createdAt":"2024-02-18T10:00:00Z","updatedAt":"2024-02-18T10:00:00Z"},
  {"id":"apr-017","clientId":"demo","dealId":"deal-012","approvalType":"ic","requestedByUserId":"user-2","requestedByName":"Елена Сидорова","status":"approved","dueAt":"2024-01-25T00:00:00Z","decidedByUserId":"user-3","decidedByName":"Мария Козлова","decidedAt":"2024-01-20T10:00:00Z","createdAt":"2024-01-12T10:00:00Z","updatedAt":"2024-01-20T10:00:00Z"},
  {"id":"apr-018","clientId":"demo","dealId":"deal-012","approvalType":"legal","requestedByUserId":"user-2","requestedByName":"Елена Сидорова","status":"approved","dueAt":"2024-02-10T00:00:00Z","decidedByUserId":"user-4","decidedByName":"Александр Волков","decidedAt":"2024-02-05T10:00:00Z","createdAt":"2024-01-25T10:00:00Z","updatedAt":"2024-02-05T10:00:00Z"},
  {"id":"apr-019","clientId":"demo","dealId":"deal-012","approvalType":"cfo","requestedByUserId":"user-2","requestedByName":"Елена Сидорова","status":"pending","dueAt":"2024-03-10T00:00:00Z","createdAt":"2024-02-15T10:00:00Z","updatedAt":"2024-02-15T10:00:00Z"},
  {"id":"apr-020","clientId":"demo","dealId":"deal-013","approvalType":"ic","requestedByUserId":"user-1","requestedByName":"Иван Петров","status":"approved","dueAt":"2023-10-01T00:00:00Z","decidedByUserId":"user-3","decidedByName":"Мария Козлова","decidedAt":"2023-09-25T10:00:00Z","createdAt":"2023-09-15T10:00:00Z","updatedAt":"2023-09-25T10:00:00Z"},
  {"id":"apr-021","clientId":"demo","dealId":"deal-013","approvalType":"cfo","requestedByUserId":"user-1","requestedByName":"Иван Петров","status":"approved","dueAt":"2023-12-10T00:00:00Z","decidedByUserId":"user-5","decidedByName":"Дмитрий Новиков","decidedAt":"2023-12-05T10:00:00Z","createdAt":"2023-11-28T10:00:00Z","updatedAt":"2023-12-05T10:00:00Z"},
  {"id":"apr-022","clientId":"demo","dealId":"deal-015","approvalType":"ic","requestedByUserId":"user-2","requestedByName":"Елена Сидорова","status":"approved","dueAt":"2024-02-10T00:00:00Z","decidedByUserId":"user-3","decidedByName":"Мария Козлова","decidedAt":"2024-02-05T10:00:00Z","createdAt":"2024-01-28T10:00:00Z","updatedAt":"2024-02-05T10:00:00Z"},
  {"id":"apr-023","clientId":"demo","dealId":"deal-015","approvalType":"legal","requestedByUserId":"user-2","requestedByName":"Елена Сидорова","status":"pending","dueAt":"2024-03-01T00:00:00Z","createdAt":"2024-02-12T10:00:00Z","updatedAt":"2024-02-12T10:00:00Z"},
  {"id":"apr-024","clientId":"demo","dealId":"deal-016","approvalType":"ic","requestedByUserId":"user-1","requestedByName":"Иван Петров","status":"approved","dueAt":"2024-01-20T00:00:00Z","decidedByUserId":"user-3","decidedByName":"Мария Козлова","decidedAt":"2024-01-15T10:00:00Z","createdAt":"2024-01-08T10:00:00Z","updatedAt":"2024-01-15T10:00:00Z"},
  {"id":"apr-025","clientId":"demo","dealId":"deal-016","approvalType":"legal","requestedByUserId":"user-1","requestedByName":"Иван Петров","status":"approved","dueAt":"2024-02-05T00:00:00Z","decidedByUserId":"user-4","decidedByName":"Александр Волков","decidedAt":"2024-02-01T10:00:00Z","createdAt":"2024-01-20T10:00:00Z","updatedAt":"2024-02-01T10:00:00Z"},
  {"id":"apr-026","clientId":"demo","dealId":"deal-016","approvalType":"cfo","requestedByUserId":"user-1","requestedByName":"Иван Петров","status":"approved","dueAt":"2024-02-20T00:00:00Z","decidedByUserId":"user-5","decidedByName":"Дмитрий Новиков","decidedAt":"2024-02-15T10:00:00Z","createdAt":"2024-02-05T10:00:00Z","updatedAt":"2024-02-15T10:00:00Z"},
  {"id":"apr-027","clientId":"demo","dealId":"deal-017","approvalType":"ic","requestedByUserId":"user-2","requestedByName":"Елена Сидорова","status":"approved","dueAt":"2023-09-01T00:00:00Z","decidedByUserId":"user-3","decidedByName":"Мария Козлова","decidedAt":"2023-08-28T10:00:00Z","createdAt":"2023-08-20T10:00:00Z","updatedAt":"2023-08-28T10:00:00Z"},
  {"id":"apr-028","clientId":"demo","dealId":"deal-017","approvalType":"cfo","requestedByUserId":"user-2","requestedByName":"Елена Сидорова","status":"approved","dueAt":"2023-11-20T00:00:00Z","decidedByUserId":"user-5","decidedByName":"Дмитрий Новиков","decidedAt":"2023-11-15T10:00:00Z","createdAt":"2023-11-01T10:00:00Z","updatedAt":"2023-11-15T10:00:00Z"},
  {"id":"apr-029","clientId":"demo","dealId":"deal-019","approvalType":"ic","requestedByUserId":"user-2","requestedByName":"Елена Сидорова","status":"pending","dueAt":"2024-03-05T00:00:00Z","createdAt":"2024-02-20T10:00:00Z","updatedAt":"2024-02-20T10:00:00Z"},